<?xml version="1.0" encoding="UTF-8"?>
<archive xmlns="http://rs.tdwg.org/dwc/terms/xsd/archive/"
	fileRoot="http://data.gbif.org/download/"
	xmlns:xsi="http://www.w3.org/2001/XMLSchema-instance"
	xmlns:xs="http://www.w3.org/2001/XMLSchema"
	xsi:schemaLocation="http://rs.tdwg.org/dwc/terms/xsd/archive/ http://darwincore.googlecode.com/svn/trunk/text/tdwg_dwc_text.xsd">
	
	<file rowType="http://rs.tdwg.org/dwc/terms/Sample" location="specimens.txt">
		<field index="0" term="http://rs.tdwg.org/dwc/terms/CatalogNumber"/>
		<field index="1" term="http://rs.tdwg.org/dwc/terms/IndividualCount"/>
	</file>
	
	<file rowType="http://rs.tdwg.org/dwc/terms/Identification" location="identifications.txt">
		<field index="0" term="http://rs.tdwg.org/dwc/terms/IdentificationID"/>
		<field index="1" term="http://rs.tdwg.org/dwc/terms/IdentifiedBy"/>
		<field index="2" term="http://rs.tdwg.org/dwc/terms/CatalogNumber"/>
		<field index="3" term="http://rs.tdwg.org/dwc/terms/ScientificName"/>
	</file>
	
	<relationships>
		<relationship>
			<file location="specimens.txt" fieldIndex="0"/>
			<file location="identifications.txt" fieldIndex="2"/>
		</relationship>
	</relationships>	
</archive>